{
  "$schema": "https://json-schema.org/draft/2020-12/schema",
  "title": "paper_profile",
  "type": "object",
  "additionalProperties": false,
  "properties": {
    "task_id": {"type": "string"},
    "generated_at_utc": {"type": "string"},
    "source_files": {
      "type": "array",
      "items": {"type": "string"}
    },
    "profile": {
      "type": "object",
      "additionalProperties": false,
      "properties": {
        "keywords": {"type": "array", "items": {"type": "string"}},
        "categories": {"type": "array", "items": {"type": "string"}},
        "short_blurb": {"type": "string"},
        "related_work_themes": {"type": "array", "items": {"type": "string"}}
      },
      "required": ["keywords", "categories", "short_blurb", "related_work_themes"]
    },
    "notes": {"type": "string"}
  },
  "required": ["task_id", "generated_at_utc", "source_files", "profile", "notes"]
}
